{
  "schemaVersion": 1,
  "stageId": "mystic-batch-v1",
  "batchId": "synthetic-contract-smoke-v1",
  "mode": "synthetic",
  "scientificExecution": false,
  "runtime": {
    "python": "3.12.4",
    "os": "ubuntu-24.04",
    "architecture": "x86_64",
    "containerImageDigest": null,
    "uvspecSha256": null,
    "libRadtranDataSha256": null,
    "atmosphereSha256": null
  },
  "limits": {
    "maximumCases": 6,
    "maximumParallel": 6,
    "maximumConfiguredMcPhotonsSum": 960000000,
    "perCaseTimeoutSeconds": 1200
  },
  "frozenInputs": {
    "method": "synthetic-reference-vroom",
    "sunDepressionDeg": 12.0,
    "targetAltitudeDeg": 10.0,
    "relativeAzimuthDeg": 120.0,
    "observerElevationM": 0,
    "aod550": 0.15,
    "wavelengthRangeNm": [380, 780],
    "diagnosticNodesNm": [470, 480, 490, 500, 510, 520, 530, 540, 560, 580, 590, 600, 610, 640, 660]
  },
  "cases": [
    {"ordinal": 1, "caseId": "synthetic-seed-77301", "seed": 77301, "photonHistories": 160000000},
    {"ordinal": 2, "caseId": "synthetic-seed-77302", "seed": 77302, "photonHistories": 160000000},
    {"ordinal": 3, "caseId": "synthetic-seed-77303", "seed": 77303, "photonHistories": 160000000},
    {"ordinal": 4, "caseId": "synthetic-seed-77304", "seed": 77304, "photonHistories": 160000000},
    {"ordinal": 5, "caseId": "synthetic-seed-77305", "seed": 77305, "photonHistories": 160000000},
    {"ordinal": 6, "caseId": "synthetic-seed-77306", "seed": 77306, "photonHistories": 160000000}
  ]
}
